{
  "schema_version": 1,
  "source": {
    "name": "spglib layer-group database",
    "metadata_version": "2.5.0",
    "operations_version": "2.5.0",
    "license": "BSD-3-Clause",
    "url": "https://github.com/spglib/spglib/blob/v2.5.0/database/layer_spg.csv"
  },
  "generated_by": "scripts/generate_crystallographic_layer_groups.py",
  "source_metadata_sha256": "c2fea76197c2d26786dcf396f0ed08b3264e386819a57c4347af43613d420053",
  "point_operation_catalog_sha256": "8bd24914eb8ac7d0796a8b778be6ab8c109a75838816c3d623ca6bcf991404b7",
  "conventions": {
    "periodic_axes": [
      "x",
      "y"
    ],
    "aperiodic_axis": "z",
    "seitz": "x' = R x + t in fractional coordinates; translations are modulo the periodic x/y lattice only",
    "settings": "all 116 spglib layer Hall settings are retained; setting_number 1 is the standard setting",
    "generators": "deterministic greedy reduction whose closure reproduces every source operation"
  },
  "layer_groups": [
    {
      "number": 1,
      "international_short": "p1",
      "international_full": "p 1",
      "schoenflies": "C1^1",
      "point_group_number": 1,
      "point_group_hm": "1",
      "point_group_schoenflies": "C1",
      "crystal_system": "triclinic",
      "centering": "P",
      "primary_layer_hall_number": 1,
      "hall_settings": [
        {
          "layer_hall_number": 1,
          "setting_number": 1,
          "choice": "",
          "standard": true,
          "hall_symbol": "p 1",
          "international": "p 1",
          "international_full": "p 1",
          "international_short": "p1",
          "centering": "P",
          "operation_count": 1,
          "generators": []
        }
      ]
    },
    {
      "number": 2,
      "international_short": "p-1",
      "international_full": "p -1",
      "schoenflies": "Ci^1",
      "point_group_number": 2,
      "point_group_hm": "-1",
      "point_group_schoenflies": "Ci",
      "crystal_system": "triclinic",
      "centering": "P",
      "primary_layer_hall_number": 2,
      "hall_settings": [
        {
          "layer_hall_number": 2,
          "setting_number": 1,
          "choice": "",
          "standard": true,
          "hall_symbol": "-p 1",
          "international": "p -1",
          "international_full": "p -1",
          "international_short": "p-1",
          "centering": "P",
          "operation_count": 2,
          "generators": [
            {
              "rotation": [
                [
                  -1,
                  0,
                  0
                ],
                [
                  0,
                  -1,
                  0
                ],
                [
                  0,
                  0,
                  -1
                ]
              ],
              "translation": [
                0.0,
                0.0,
                0.0
              ]
            }
          ]
        }
      ]
    },
    {
      "number": 3,
      "international_short": "p112",
      "international_full": "p 1 1 2",
      "schoenflies": "C2^1",
      "point_group_number": 3,
      "point_group_hm": "2",
      "point_group_schoenflies": "C2",
      "crystal_system": "monoclinic",
      "centering": "P",
      "primary_layer_hall_number": 3,
      "hall_settings": [
        {
          "layer_hall_number": 3,
          "setting_number": 1,
          "choice": "c",
          "standard": true,
          "hall_symbol": "p 2",
          "international": "p 1 1 2",
          "international_full": "p 1 1 2",
          "international_short": "p112",
          "centering": "P",
          "operation_count": 2,
          "generators": [
            {
              "rotation": [
                [
                  -1,
                  0,
                  0
                ],
                [
                  0,
                  -1,
                  0
                ],
                [
                  0,
                  0,
                  1
                ]
              ],
              "translation": [
                0.0,
                0.0,
                0.0
              ]
            }
          ]
        }
      ],
      "point_group_embedding": "z"
    },
    {
      "number": 4,
      "international_short": "p11m",
      "international_full": "p 1 1 m",
      "schoenflies": "Cs^1",
      "point_group_number": 4,
      "point_group_hm": "m",
      "point_group_schoenflies": "Cs",
      "crystal_system": "monoclinic",
      "centering": "P",
      "primary_layer_hall_number": 4,
      "hall_settings": [
        {
          "layer_hall_number": 4,
          "setting_number": 1,
          "choice": "c",
          "standard": true,
          "hall_symbol": "p -2",
          "international": "p 1 1 m",
          "international_full": "p 1 1 m",
          "international_short": "p11m",
          "centering": "P",
          "operation_count": 2,
          "generators": [
            {
              "rotation": [
                [
                  1,
                  0,
                  0
                ],
                [
                  0,
                  1,
                  0
                ],
                [
                  0,
                  0,
                  -1
                ]
              ],
              "translation": [
                0.0,
                0.0,
                0.0
              ]
            }
          ]
        }
      ],
      "point_group_embedding": "m_001"
    },
    {
      "number": 5,
      "international_short": "p11a",
      "international_full": "p 1 1 a",
      "schoenflies": "Cs^2",
      "point_group_number": 4,
      "point_group_hm": "m",
      "point_group_schoenflies": "Cs",
      "crystal_system": "monoclinic",
      "centering": "P",
      "primary_layer_hall_number": 5,
      "hall_settings": [
        {
          "layer_hall_number": 5,
          "setting_number": 1,
          "choice": "c1",
          "standard": true,
          "hall_symbol": "p -2a",
          "international": "p 1 1 a",
          "international_full": "p 1 1 a",
          "international_short": "p11a",
          "centering": "P",
          "operation_count": 2,
          "generators": [
            {
              "rotation": [
                [
                  1,
                  0,
                  0
                ],
                [
                  0,
                  1,
                  0
                ],
                [
                  0,
                  0,
                  -1
                ]
              ],
              "translation": [
                0.5,
                0.0,
                0.0
              ]
            }
          ]
        },
        {
          "layer_hall_number": 6,
          "setting_number": 2,
          "choice": "c2",
          "standard": false,
          "hall_symbol": "p -2ab",
          "international": "p 1 1 n",
          "international_full": "p 1 1 n",
          "international_short": "p11n",
          "centering": "P",
          "operation_count": 2,
          "generators": [
            {
              "rotation": [
                [
                  1,
                  0,
                  0
                ],
                [
                  0,
                  1,
                  0
                ],
                [
                  0,
                  0,
                  -1
                ]
              ],
              "translation": [
                0.5,
                0.5,
                0.0
              ]
            }
          ]
        },
        {
          "layer_hall_number": 7,
          "setting_number": 3,
          "choice": "c3",
          "standard": false,
          "hall_symbol": "p -2b",
          "international": "p 1 1 b",
          "international_full": "p 1 1 b",
          "international_short": "p11b",
          "centering": "P",
          "operation_count": 2,
          "generators": [
            {
              "rotation": [
                [
                  1,
                  0,
                  0
                ],
                [
                  0,
                  1,
                  0
                ],
                [
                  0,
                  0,
                  -1
                ]
              ],
              "translation": [
                0.0,
                0.5,
                0.0
              ]
            }
          ]
        }
      ],
      "point_group_embedding": "m_001"
    },
    {
      "number": 6,
      "international_short": "p112/m",
      "international_full": "p 1 1 2/m",
      "schoenflies": "C2h^1",
      "point_group_number": 5,
      "point_group_hm": "2/m",
      "point_group_schoenflies": "C2h",
      "crystal_system": "monoclinic",
      "centering": "P",
      "primary_layer_hall_number": 8,
      "hall_settings": [
        {
          "layer_hall_number": 8,
          "setting_number": 1,
          "choice": "c",
          "standard": true,
          "hall_symbol": "-p 2",
          "international": "p 1 1 2/m",
          "international_full": "p 1 1 2/m",
          "international_short": "p112/m",
          "centering": "P",
          "operation_count": 4,
          "generators": [
            {
              "rotation": [
                [
                  -1,
                  0,
                  0
                ],
                [
                  0,
                  -1,
                  0
                ],
                [
                  0,
                  0,
                  -1
                ]
              ],
              "translation": [
                0.0,
                0.0,
                0.0
              ]
            },
            {
              "rotation": [
                [
                  -1,
                  0,
                  0
                ],
                [
                  0,
                  -1,
                  0
                ],
                [